{
  "$schema": "https://json-schema.org/draft/2020-12/schema",
  "title": "Precon deck list",
  "description": "Schema for decks.json — one entry per Magic precon tracked.",
  "type": "array",
  "items": {
    "type": "object",
    "required": ["id", "name", "set", "setType", "releaseDate", "colors", "msrp"],
    "additionalProperties": false,
    "properties": {
      "id": {
        "type": "string",
        "pattern": "^[a-z0-9-]+$",
        "description": "URL-safe slug. Lowercase letters, digits, hyphens only."
      },
      "name": { "type": "string", "minLength": 1 },
      "set": { "type": "string", "minLength": 1 },
      "setType": { "enum": ["standard", "ub", "commander"] },
      "releaseDate": {
        "type": "string",
        "pattern": "^\\d{4}-\\d{2}-\\d{2}$",
        "format": "date",
        "description": "ISO date (YYYY-MM-DD), a real calendar date."
      },
      "colors": {
        "type": "array",
        "items": { "enum": ["W", "U", "B", "R", "G", "C"] },
        "uniqueItems": true,
        "minItems": 1
      },
      "commander": {
        "type": "string",
        "minLength": 1,
        "description": "The face commander, as Wizards presents the deck."
      },
      "partner": {
        "type": "string",
        "minLength": 1,
        "description": "A true second commander: set only when the command zone holds two cards. Alternates go in altCommanders."
      },
      "altCommanders": {
        "type": "array",
        "items": { "type": "string", "minLength": 1 },
        "uniqueItems": true,
        "minItems": 1,
        "description": "The deck's other foil cards that can be its commander (its alternate commanders), besides commander and partner."
      },
      "desc": { "type": "string" },
      "msrp": {
        "type": "number",
        "exclusiveMinimum": 0,
        "maximum": 500,
        "description": "US MSRP in dollars. Drives the discount math, so never 0."
      },
      "power": { "type": "number", "minimum": 0, "maximum": 10 },
      "powerScore": { "type": "number", "minimum": 0, "maximum": 10 },
      "powerBracket": { "enum": ["B1", "B2", "B3", "B4", "B5"] },
      "scryCheckSlug": { "type": "string" },
      "formerIds": {
        "type": "array",
        "items": { "type": "string", "pattern": "^[a-z0-9-]+$" },
        "uniqueItems": true,
        "minItems": 1,
        "description": "Ids this deck had before a rename. The scraper moves their price history and the page moves saved user data to the current id."
      }
    }
  }
}
