[
  {
    "id": "federation-fleet",
    "scryCheckSlug": "federation-fleet",
    "name": "Federation Fleet",
    "set": "Star Trek",
    "setType": "standard",
    "releaseDate": "2026-11-13",
    "colors": [
      "W",
      "U",
      "R"
    ],
    "commander": "Jean-Luc Picard, Luminary",
    "altCommanders": [
      "Captain Janeway, Endgame"
    ],
    "desc": "Jeskai historic and Spacecraft deck led by Picard: he draws a card whenever another historic permanent with mana value 3 or greater enters, and each turn you draw your second card he grows a creature and charges a Spacecraft. Captain Janeway leads an aggressive Officer token alternate.",
    "msrp": 74.99
  },
  {
    "id": "landing-party",
    "scryCheckSlug": "landing-party",
    "name": "Landing Party",
    "set": "Star Trek",
    "setType": "standard",
    "releaseDate": "2026-11-13",
    "colors": [
      "W",
      "U",
      "G"
    ],
    "commander": "Commander Spock",
    "altCommanders": [
      "Captain Kirk, Boldly Going"
    ],
    "desc": "Bant lands and landfall: whenever Commander Spock enters or attacks he reveals your top card and casts it for free if its mana value is no more than the number of differently named lands you control. Captain Kirk leads a Spacecraft alternate that keeps the Starship Enterprise on hand.",
    "msrp": 74.99
  },
  {
    "id": "klingon-fury",
    "scryCheckSlug": "klingon-fury",
    "name": "Klingon Fury",
    "set": "Star Trek",
    "setType": "standard",
    "releaseDate": "2026-11-13",
    "colors": [
      "W",
      "B",
      "R"
    ],
    "commander": "Worf, Defiant Commander",
    "altCommanders": [
      "Kor, Cause of Vengeance"
    ],
    "desc": "Mardu Klingon Warriors that attack the whole table: Worf brings a hasty 2/1 Warrior, and his battlefront ability lets you play one card off the top of your library for each opponent you attacked. Kor leads a sacrifice alternate that pumps Klingons and Warriors.",
    "msrp": 74.99
  },
  {
    "id": "we-are-the-borg",
    "scryCheckSlug": "we-are-the-borg",
    "name": "We Are the Borg",
    "set": "Star Trek",
    "setType": "standard",
    "releaseDate": "2026-11-13",
    "colors": [
      "W",
      "U",
      "B"
    ],
    "commander": "The Borg Queen",
    "altCommanders": [
      "Locutus of Borg"
    ],
    "desc": "Esper artifact creatures and Borg tokens: The Borg Queen gives artifact creatures +2/+2, and whenever she enters or attacks she assimilates the first creature card off an opponent's library onto your side. Locutus of Borg leads a lifelink alternate whose artifact creatures make 1/1 Borg tokens on combat damage.",
    "msrp": 74.99
  },
  {
    "id": "multiverse-reforged",
    "scryCheckSlug": "multiverse-reforged",
    "name": "Multiverse Reforged",
    "set": "Reality Fracture",
    "setType": "standard",
    "releaseDate": "2026-10-02",
    "colors": [
      "W",
      "U",
      "B",
      "R"
    ],
    "commander": "Jace, Multiverse Architect",
    "altCommanders": [
      "Nissa, Leyline Tamer"
    ],
    "desc": "Four color planeswalker deck led by Jace: each turn he draws two cards and filters one away, he can trade one of your creatures or planeswalkers for a random new one from the top of your library, and opponents must pay a tax to attack him.",
    "msrp": 49.99,
    "powerScore": 4.7,
    "powerBracket": "B2"
  },
  {
    "id": "calling-all-angels",
    "scryCheckSlug": "calling-all-angels",
    "name": "Calling All Angels",
    "set": "Foundations Commander Decks",
    "setType": "commander",
    "releaseDate": "2026-10-02",
    "colors": [
      "W"
    ],
    "commander": "Giada, Font of Hope",
    "desc": "Mono white Angels: Giada makes every Angel enter with extra +1/+1 counters for each Angel already in play, and taps for mana to cast them. A beginner friendly flying army that snowballs.",
    "msrp": 29.99,
    "powerScore": 5.0,
    "powerBracket": "B3"
  },
  {
    "id": "keen-engineering",
    "scryCheckSlug": "keen-engineering",
    "name": "Keen Engineering",
    "set": "Foundations Commander Decks",
    "setType": "commander",
    "releaseDate": "2026-10-02",
    "colors": [
      "U"
    ],
    "commander": "Sai, Master Thopterist",
    "desc": "Mono blue artifacts: every artifact you cast makes a 1/1 flying Thopter with Sai, and spare artifacts can be sacrificed to draw cards. A simple, steady value engine.",
    "msrp": 29.99,
    "powerScore": 4.8,
    "powerBracket": "B2"
  },
  {
    "id": "wretched-ranks",
    "scryCheckSlug": "wretched-ranks",
    "name": "Wretched Ranks",
    "set": "Foundations Commander Decks",
    "setType": "commander",
    "releaseDate": "2026-10-02",
    "colors": [
      "B"
    ],
    "commander": "Ghoulcaller Gisa",
    "desc": "Mono black Zombies and sacrifice: Gisa turns one creature into a horde of 2/2 Zombies equal to its power, so every body you sacrifice comes back as an army.",
    "msrp": 29.99,
    "powerScore": 4.5,
    "powerBracket": "B2"
  },
  {
    "id": "reign-of-dragons",
    "scryCheckSlug": "reign-of-dragons",
    "name": "Reign of Dragons",
    "set": "Foundations Commander Decks",
    "setType": "commander",
    "releaseDate": "2026-10-02",
    "colors": [
      "R"
    ],
    "commander": "Lathliss, Dragon Queen",
    "desc": "Mono red Dragons: each nontoken Dragon you play brings a free 5/5 flying Dragon token with Lathliss, and she can pump the whole flight. Big fliers, fast clocks.",
    "msrp": 29.99,
    "powerScore": 4.8,
    "powerBracket": "B2"
  },
  {
    "id": "tramplesaurus-rex",
    "scryCheckSlug": "tramplesaurus-rex",
    "name": "Tramplesaurus Rex",
    "set": "Foundations Commander Decks",
    "setType": "commander",
    "releaseDate": "2026-10-02",
    "colors": [
      "G"
    ],
    "commander": "Ghalta, Primal Hunger",
    "desc": "Mono green stompy: Elf and Druid ramp into Dinosaurs and other big creatures, then Ghalta costs almost nothing to cast and tramples over blockers.",
    "msrp": 29.99,
    "powerScore": 5.3,
    "powerBracket": "B3"
  },
  {
    "id": "avengers-assemble",
    "scryCheckSlug": "avengers-assemble",
    "name": "Avengers Assemble",
    "set": "Marvel Super Heroes",
    "setType": "ub",
    "releaseDate": "2026-06-26",
    "colors": [
      "W",
      "U",
      "R"
    ],
    "commander": "Captain America, Team Leader",
    "desc": "Jeskai Heroes team up: rally a squad, suit them up with Equipment, and pile on +1/+1 counters. Captain America throws his shield to repeatedly buff and protect the team.",
    "msrp": 74.99,
    "power": 3.0,
    "powerScore": 4.6,
    "powerBracket": "B2"
  },
  {
    "id": "wakanda-forever",
    "scryCheckSlug": "wakanda-forever",
    "name": "Wakanda Forever",
    "set": "Marvel Super Heroes",
    "setType": "ub",
    "releaseDate": "2026-06-26",
    "colors": [
      "W",
      "G"
    ],
    "commander": "T'Challa, the Black Panther",
    "desc": "Selesnya Wakandan forces grind value through creatures and support abilities, building a resilient board on the path to victory.",
    "msrp": 74.99,
    "power": 3.0,
    "powerScore": 3.8,
    "powerBracket": "B2"
  },
  {
    "id": "the-fantastic-four",
    "scryCheckSlug": "the-fantastic-four",
    "name": "The Fantastic Four",
    "set": "Marvel Super Heroes",
    "setType": "ub",
    "releaseDate": "2026-06-26",
    "colors": [
      "W",
      "U",
      "R",
      "G"
    ],
    "commander": "Mister Fantastic",
    "altCommanders": [
      "Invisible Woman",
      "Human Torch",
      "The Thing"
    ],
    "desc": "Four color (no black) noncreature spell engine: Invisible Woman's Walls hold the line while you push scientific innovation, then the team launches a heavy counterattack. Pick any of the four members to lead.",
    "msrp": 74.99,
    "power": 3.0,
    "powerScore": 4.8,
    "powerBracket": "B2"
  },
  {
    "id": "doom-prevails",
    "scryCheckSlug": "doom-prevails",
    "name": "Doom Prevails",
    "set": "Marvel Super Heroes",
    "setType": "ub",
    "releaseDate": "2026-06-26",
    "colors": [
      "U",
      "B",
      "R"
    ],
    "commander": "Doctor Doom, King of Latveria",
    "desc": "Grixis villains scheme with connive to grow units and drain opponents. Loki offers an alternate build for deceptive tactics that copy the best villain.",
    "msrp": 74.99,
    "power": 3.0,
    "powerScore": 4.7,
    "powerBracket": "B2"
  },
  {
    "id": "quandrix-unlimited",
    "scryCheckSlug": "quandrix-unlimited",
    "name": "Quandrix Unlimited",
    "set": "Secrets of Strixhaven",
    "setType": "standard",
    "releaseDate": "2026-04-24",
    "colors": [
      "U",
      "G"
    ],
    "commander": "Zimone, Infinite Analyst",
    "altCommanders": [
      "Primo, the Unbounded"
    ],
    "desc": "X spells and +1/+1 counters in one tight package. Zimone makes X spells cheaper as she grows, and nearly every payoff in the deck scales with mana. Pure Simic ramp into haymakers.",
    "msrp": 49.99,
    "power": 2.5,
    "powerScore": 3.8,
    "powerBracket": "B2"
  },
  {
    "id": "silverquill-influence",
    "scryCheckSlug": "silverquill-influence",
    "name": "Silverquill Influence",
    "set": "Secrets of Strixhaven",
    "setType": "standard",
    "releaseDate": "2026-04-24",
    "colors": [
      "W",
      "B"
    ],
    "commander": "Killian, Decisive Mentor",
    "altCommanders": [
      "Scriv, the Obligator"
    ],
    "desc": "Auras on opponents' creatures to goad them into attacking each other while you draw cards. Highest reprint value of the Strixhaven cycle. Political and passive aggressive.",
    "msrp": 49.99,
    "power": 2.5,
    "powerScore": 3.8,
    "powerBracket": "B2"
  },
  {
    "id": "prismari-artistry",
    "scryCheckSlug": "prismari-artistry",
    "name": "Prismari Artistry",
    "set": "Secrets of Strixhaven",
    "setType": "standard",
    "releaseDate": "2026-04-24",
    "colors": [
      "U",
      "R"
    ],
    "commander": "Rootha, Mastering the Moment",